{
  "turn": "white",
  "mode": "play",
  "winner": null,
  "actionsRemaining": 1,
  "moveCount": 2,
  "fullMove": 2,
  "turnsTaken": {"white":1,"black":1},
  "cardsUsedThisTurn": {"white":1,"black":0},
  "board": [
    [
      {"type":"rook","color":"black","moved":false},
      {"type":"knight","color":"black","moved":false},
      {"type":"bishop","color":"black","moved":false},
      {"type":"queen","color":"black","moved":false},
      {"type":"king","color":"black","moved":false},
      {"type":"bishop","color":"black","moved":false},
      {"type":"knight","color":"black","moved":false},
      {"type":"rook","color":"black","moved":false}
    ],
    [
      {"type":"fanatic","color":"black","moved":true,"freshNoCaptureUntil":1},
      null,
      {"type":"pawn","color":"black","moved":false},
      {"type":"pawn","color":"black","moved":false},
      {"type":"pawn","color":"black","moved":false},
      {"type":"pawn","color":"black","moved":false},
      {"type":"pawn","color":"black","moved":false},
      {"type":"pawn","color":"black","moved":false}
    ],
    [
      {"type":"magicGirl","color":"black","moved":false},
      null,
      null,
      null,
      null,
      null,
      null,
      {"type":"camel","color":"black","moved":false}
    ],
    [null,{"type":"pawn","color":"black","moved":true},null,null,null,null,null,null],
    [null,null,null,null,null,null,null,null],
    [
      {"type":"siren","color":"white","moved":false},
      null,
      {"type":"knight","color":"white","moved":true},
      null,
      null,
      null,
      null,
      null
    ],
    [
      {"type":"pawn","color":"white","moved":false},
      {"type":"pawn","color":"white","moved":false},
      {"type":"pawn","color":"white","moved":false},
      {"type":"pawn","color":"white","moved":false},
      {"type":"pawn","color":"white","moved":false},
      {"type":"pawn","color":"white","moved":false},
      {"type":"pawn","color":"white","moved":false},
      {"type":"pawn","color":"white","moved":false}
    ],
    [
      {"type":"rook","color":"white","moved":false},
      null,
      {"type":"bishop","color":"white","moved":false},
      {"type":"queen","color":"white","moved":false},
      {"type":"king","color":"white","moved":false},
      {"type":"bishop","color":"white","moved":false},
      {"type":"knight","color":"white","moved":false},
      {"type":"rook","color":"white","moved":false}
    ]
  ],
  "deckSlots": {
    "white": [
      {"id":"horde","instanceId":"white-horde-1","effect":"horde","stars":2,"used":true,"recovering":false},
      {
        "id": "hallucination",
        "instanceId": "white-hallucination-2",
        "effect": "hallucination",
        "stars": 4,
        "used": false,
        "recovering": false
      },
      {
        "id": "fanaticalRitual",
        "instanceId": "white-fanaticalRitual-3",
        "effect": "fanaticalRitual",
        "stars": 4,
        "used": true,
        "recovering": false
      },
      {
        "id": "proficiency",
        "instanceId": "white-proficiency-4",
        "effect": "proficiency",
        "stars": 3,
        "used": true,
        "recovering": false
      }
    ],
    "black": [
      {
        "id": "longEnPassant",
        "instanceId": "black-longEnPassant-1",
        "effect": "longEnPassant",
        "stars": 1,
        "used": false,
        "recovering": false
      },
      {
        "id": "ruleTicket",
        "instanceId": "black-ruleTicket-2",
        "effect": "ruleTicket",
        "stars": 1,
        "used": false,
        "recovering": false
      },
      {
        "id": "armistice",
        "instanceId": "black-armistice-3",
        "effect": "armistice",
        "stars": 2,
        "used": false,
        "recovering": false
      }
    ]
  },
  "captures": {"white":[],"black":[]},
  "enPassant": {"row":2,"col":1,"capturedRow":3,"capturedCol":1,"color":"black"},
  "extra": {
    "aiSearchNoCards": false,
    "skipRandomVanishing": true,
    "campaign": null,
    "acceleration": false,
    "idolEncoreUsedByPiece": {},
    "draftDelete": false,
    "collapsed": false,
    "collapseDepth": 0,
    "collapsedCells": [],
    "periodicCollapse": null,
    "ruleBombs": [],
    "saturationRule": false,
    "portalRule": null,
    "crownRule": null,
    "conveyorRule": false,
    "armistice": null,
    "pendingPortals": [],
    "exhaustion": {"white":{"enabled":false,"pieceId":"","count":0},"black":{"enabled":false,"pieceId":"","count":0}},
    "mistakeCard": {"white":false,"black":false},
    "democracy": {"white":false,"black":false},
    "hillKing": {"white":false,"black":false},
    "genevaConvention": {"white":false,"black":false},
    "platformRule": null,
    "mistakeRule": false,
    "transcendenceRule": false,
    "camouflageRule": false,
    "binaMate": {"white":false,"black":false},
    "overwhelm": {"white":false,"black":false},
    "effects": {},
    "regency": {},
    "retreat": {},
    "racingKing": {},
    "radicalCharge": {},
    "encouragement": {},
    "ironMonarch": {},
    "imperialStudies": {},
    "religiousVictory": {},
    "backwardKnight": {},
    "trojanHorse": {},
    "madHorse": {},
    "clonePassive": {},
    "frontlineResponse": {"white":false,"black":false},
    "relay": {"white":false,"black":false},
    "fieldPromotion": {"white":false,"black":false},
    "gomoku": {"white":false,"black":false},
    "magicGirlSurge": {"white":false,"black":false},
    "moveReplay": {"white":null,"black":null},
    "sirenExposure": {"__turnStartKey":"white:1"},
    "clonedPassiveCards": {"white":[],"black":[]},
    "vanishing": {},
    "knightInjury": {},
    "fianchetto": {},
    "pawnSprint": {},
    "pawnConversion": {},
    "pawnLeap": {},
    "fileSurge": {},
    "rookLift": {},
    "underpromotion": {},
    "finalWeapon": {},
    "highway": false,
    "recycling": false,
    "coolGuy": false,
    "manner": {"white":false,"black":false},
    "freeCastling": {"white":false,"black":false},
    "switcheroo": {"white":false,"black":false},
    "substitution": {"white":false,"black":false},
    "cornerKick": {},
    "chainBonds": [],
    "moving": {"white":{"enabled":false,"pieceId":"","count":0},"black":{"enabled":false,"pieceId":"","count":0}},
    "castlingCanceled": {"white":false,"black":false},
    "castled": {},
    "bishopSnipe": {"white":false,"black":false},
    "breakthroughPawns": {"white":false,"black":false},
    "highGround": [],
    "appliedRuleCard": null,
    "additionalRuleCards": [],
    "pendingRuleTickets": [],
    "initiative": {},
    "machoChess": false,
    "palaces": [],
    "kingKnight": {},
    "royalKnightKing": {},
    "socialism": {},
    "taunt": {},
    "hallucination": {"white":null,"black":null},
    "prophecy": {"white":null,"black":null},
    "diceLocks": {},
    "lastMove": null,
    "accelerationTrail": null,
    "overtakeTurnOnly": true,
    "undeadResurrections": [],
    "enPassantFrenzy": {"white":false,"black":false},
    "cannonScarecrowScreen": true,
    "internalSixFixes": true,
    "vanguardDiagonalOnly": true,
    "parrotRookTarget": true,
    "extinctionMinorTargets": true,
    "scarecrowPieceReservation": true,
    "september18Balance": true,
    "othelloPending": {"white":false,"black":false},
    "cannonGhostScreen": true,
    "unifiedJumpObstacles": true,
    "parrotBasicMovement": true,
    "miracleSelectsBishop": true,
    "thiefQuietJump": true,
    "thiefRequiredJump": false,
    "thiefRemake": true,
    "zugzwangConsumesTurn": true,
    "zugzwang": {"white":false,"black":false},
    "pendingPanic": [],
    "pendingFreeMoves": [],
    "freeMoveCaptureLock": {"white":false,"black":false},
    "chaosNoCaptureUntilHalfTurn": 0,
    "pendingIcbm": [],
    "pendingTrojanHorse": [],
    "pendingGales": [],
    "pendingOtherworld": [],
    "judgmentExiles": [],
    "pendingTrolley": [],
    "pendingScarecrows": [],
    "pendingLobsters": [],
    "activeTrolley": null,
    "pendingPawnStorm": [],
    "afterimageQueen": {},
    "kingDead": {},
    "quantumPending": {},
    "coronation": {},
    "earlyPromotion": {},
    "fastGrowth": {},
    "royalCommand": {"white":null,"black":null},
    "aiSearchBonus": {"white":315},
    "blackHole": [],
    "winterKingdom": {"enabled":false,"lastCycle":0,"frozenIds":[]},
    "ultimatum": null,
    "delayedHazards": [],
    "skipTurn": {},
    "recentMoves": [
      {"from":{"row":7,"col":1},"to":{"row":5,"col":2},"pieceId":"","pieceType":"knight","color":"white"},
      {"from":{"row":1,"col":1},"to":{"row":3,"col":1},"pieceId":"","pieceType":"pawn","color":"black"}
    ],
    "monochromeChess": false,
    "parrotMovement": {"white":{"type":"knight"},"black":{"type":"pawn"}},
    "proficiency": {"white":true}
  }
}
